{
  "schemaVersion": "1.0",
  "frame": {
    "sequence": 7,
    "width": 1920,
    "height": 1080,
    "scaleFactor": 1
  },
  "fingerprint": {
    "algorithm": "grid-luma-1",
    "gridSize": 8,
    "cells": [
      0,
      1,
      2,
      3,
      4,
      5,
      6,
      7,
      8,
      9,
      10,
      11,
      12,
      13,
      14,
      15,
      16,
      17,
      18,
      19,
      20,
      21,
      22,
      23,
      24,
      25,
      26,
      27,
      28,
      29,
      30,
      31,
      32,
      33,
      34,
      35,
      36,
      37,
      38,
      39,
      40,
      41,
      42,
      43,
      44,
      45,
      46,
      47,
      48,
      49,
      50,
      51,
      52,
      53,
      54,
      55,
      56,
      57,
      58,
      59,
      60,
      61,
      62,
      63
    ],
    "strictHash": "0123456789abcdef"
  },
  "regions": [
    {
      "identity": 1,
      "class": "changed",
      "bounds": {
        "x": 0.25,
        "y": 0.3,
        "w": 0.1,
        "h": 0.05
      },
      "magnitude": 0.42,
      "areaPixels": 10368,
      "identityConfidence": 1,
      "identityUncertain": false
    },
    {
      "identity": 2,
      "class": "moved",
      "bounds": {
        "x": 0.6,
        "y": 0.7,
        "w": 0.05,
        "h": 0.04
      },
      "previousBounds": {
        "x": 0.1,
        "y": 0.2,
        "w": 0.2,
        "h": 0.1
      },
      "magnitude": 0.31,
      "areaPixels": 4128,
      "identityConfidence": 0.64,
      "identityUncertain": true
    }
  ],
  "conditions": [
    "viewport-changed"
  ]
}
